,tweet_id,timestamp,source,text,rating_numerator,rating_denominator,pet_name,stage,retweet_count,favorite_count,image_url,image_number,first_prediction,first_prediction_confidence(%),first_prediction_is_dog,second_prediction,second_prediction_confidence(%),second_prediction_is_dog,third_prediction,third_prediction_confidence(%),third_prediction_is_dog
985,708479650088034305,2016-03-12 02:28:06 +0000,"<a href=""http://twitter.com/download/iphone"" rel=""nofollow"">Twitter for iPhone</a>",Meet Bear. He's a Beneboop Cumberclap. Extremely unamused. 13/10 I'm in love with this picture https://t.co/uC8kUqAz0W,13,10,Bear,    ,765,2768,https://pbs.twimg.com/media/CdUGcLMWAAI42q0.jpg,1,Shih-Tzu,21.8,True,Lhasa,20.2,True,Norfolk Terrier,16.5,True
986,708469915515297792,2016-03-12 01:49:25 +0000,"<a href=""http://twitter.com/download/iphone"" rel=""nofollow"">Twitter for iPhone</a>",This is Bobble. He's a Croatian Galifianakis. Hears everything within 400 miles. 11/10 would snug diligently https://t.co/VwDc6PTDzk,11,10,Bobble,    ,926,3357,https://pbs.twimg.com/media/CdT9n7mW0AQcpZU.jpg,1,Chihuahua,74.8,True,Toy Terrier,12.8,True,Pembroke,4.2,True
987,708356463048204288,2016-03-11 18:18:36 +0000,"<a href=""http://twitter.com/download/iphone"" rel=""nofollow"">Twitter for iPhone</a>",This is Oliver. That is his castle. He protects it with his life. He's also squishy af. 10/10 would squish softly https://t.co/oSuEGw0BhX,10,10,Oliver,    ,1520,3929,https://pbs.twimg.com/media/CdSWcc1XIAAXc6H.jpg,2,Pug,87.1,True,French Bulldog,4.2,True,Bath Towel,1.5,False
988,708349470027751425,2016-03-11 17:50:48 +0000,"<a href=""http://twitter.com/download/iphone"" rel=""nofollow"">Twitter for iPhone</a>",This is River. He's changing the trumpet game. Innovative af. 11/10 such a good boy https://t.co/tK7a0AxQfd,11,10,River,    ,831,2568,https://pbs.twimg.com/media/CdSQFWOWAAApgfq.jpg,1,Muzzle,24.4,False,Basenji,18.7,True,Boston Bull,9.3,True
989,708149363256774660,2016-03-11 04:35:39 +0000,"<a href=""http://twitter.com/download/iphone"" rel=""nofollow"">Twitter for iPhone</a>",This is Jebberson. He's the reigning hide and seek world champion. 10/10 hasn't lost his touch https://t.co/VEFkvWCoHF,10,10,Jebberson,    ,1727,4672,https://pbs.twimg.com/media/CdPaEkHW8AA-Wom.jpg,1,Cardigan,35.1,True,Basset,16.5,True,Toy Terrier,8.0,True
990,708130923141795840,2016-03-11 03:22:23 +0000,"<a href=""http://twitter.com/download/iphone"" rel=""nofollow"">Twitter for iPhone</a>",Please stop sending in non canines like this Guatemalan Twiggle Bunny. We only rate dogs. Only send in dogs... 11/10 https://t.co/XKhobeGuvT,11,10, ,    ,943,3707,https://pbs.twimg.com/media/CdPJUWIWIAAIchl.jpg,1,French Bulldog,71.0,True,Chihuahua,26.2,True,Cardigan,0.7,True
991,708119489313951744,2016-03-11 02:36:57 +0000,"<a href=""http://twitter.com/download/iphone"" rel=""nofollow"">Twitter for iPhone</a>",This is Cooper. He basks in the glory of rebellion. 9/10 probably a preteen https://t.co/kDamUfeIpm,9,10,Cooper,    ,1102,2937,https://pbs.twimg.com/media/CdO-6x5W8AENSBJ.jpg,1,Norwich Terrier,26.4,True,Norfolk Terrier,25.9,True,Chow,9.7,True
992,708109389455101952,2016-03-11 01:56:49 +0000,"<a href=""http://twitter.com/download/iphone"" rel=""nofollow"">Twitter for iPhone</a>",This is Remington. He was caught off guard by the magical floating cheese. Spooked af. 10/10 deep breaths pup https://t.co/mhPSADiJmZ,10,10,Remington,    ,610,2124,https://pbs.twimg.com/media/CdO1u9vWAAApj2V.jpg,1,Staffordshire Bullterrier,51.6,True,American Staffordshire Terrier,23.6,True,Kelpie,7.0,True
993,708026248782585858,2016-03-10 20:26:26 +0000,"<a href=""http://twitter.com/download/iphone"" rel=""nofollow"">Twitter for iPhone</a>",Everybody stop what you're doing and watch this video. Frank is stuck in a loop. 13/10 (Vid by @klbmatty) https://t.co/5AJs8TIV1U,13,10, ,    ,2166,4799,https://pbs.twimg.com/ext tw video thumb/708026062568087553/pu/img/rNhylAwIfb6YthGu.jpg,1,Malinois,78.6,True,Chesapeake Bay Retriever,6.9,True,Siamese Cat,2.9,False
994,707995814724026368,2016-03-10 18:25:30 +0000,"<a href=""http://twitter.com/download/iphone"" rel=""nofollow"">Twitter for iPhone</a>",This is Farfle. He lost his back legs during the Battle of Gettysburg. Goes 0-60 in 4.3 seconds (damn) 12/10 hero af https://t.co/NiQQWzIzzq,12,10,Farfle,    ,1273,3385,https://pbs.twimg.com/media/CdNOb17WwAA5z4A.jpg,1,Agama,17.2,False,Gila Monster,12.7,False,Lumbermill,5.0,False
995,707969809498152960,2016-03-10 16:42:10 +0000,"<a href=""http://twitter.com/download/iphone"" rel=""nofollow"">Twitter for iPhone</a>",Meet Rufus. He's a Honeysuckle Firefox. Curly af. Badass tie. About to go on his first date ever 11/10 good luck pup https://t.co/dGoTWNfIsm,11,10,Rufus,    ,1097,2941,https://pbs.twimg.com/media/CdM2xRpXEAUsR4k.jpg,1,Toy Poodle,90.8,True,Miniature Poodle,8.3,True,Teddy,0.6,False
996,707776935007539200,2016-03-10 03:55:45 +0000,"<a href=""http://twitter.com/download/iphone"" rel=""nofollow"">Twitter for iPhone</a>",This is Sadie. She's a Bohemian Rhapsody. Remarkably portable. Could sneak on roller coasters with (probably). 11/10 https://t.co/DB8fyeDs8B,11,10,Sadie,    ,1079,3593,https://pbs.twimg.com/media/CdKHWimWoAABs08.jpg,1,Miniature Pinscher,89.0,True,Toy Terrier,5.1,True,Chihuahua,1.8,True
997,707741517457260545,2016-03-10 01:35:01 +0000,"<a href=""http://twitter.com/download/iphone"" rel=""nofollow"">Twitter for iPhone</a>",When your roommate eats your leftover Chili's but you pretend it's no big deal cuz you fat anyway. 10/10 head up pup https://t.co/0nMgoue8IR,10,10, ,    ,696,2718,https://pbs.twimg.com/media/CdJnJ1dUEAARNcf.jpg,1,Whippet,73.8,True,Italian Greyhound,19.2,True,American Staffordshire Terrier,2.0,True
998,707693576495472641,2016-03-09 22:24:31 +0000,"<a href=""http://twitter.com/download/iphone"" rel=""nofollow"">Twitter for iPhone</a>",This is Jiminus. He's in a tub for some reason. What a jokester. Smh 7/10 churlish af https://t.co/84L4ED9Tpi,7,10,Jiminus,    ,1133,3765,https://pbs.twimg.com/media/CdI7jDnW0AA2dtO.jpg,1,Bathtub,50.0,False,Tub,48.8,False,Washbasin,0.9,False
999,707610948723478529,2016-03-09 16:56:11 +0000,"<a href=""http://twitter.com/download/iphone"" rel=""nofollow"">Twitter for iPhone</a>",This is Harper. She scraped her elbow attempting a backflip off a tree. Valiant effort tho. 12/10 https://t.co/oHKJHghrp5,12,10,Harper,    ,7236,18557,https://pbs.twimg.com/media/CdHwZd0VIAA4792.jpg,1,Golden Retriever,38.3,True,Cocker Spaniel,16.6,True,Chesapeake Bay Retriever,11.8,True
1000,707420581654872064,2016-03-09 04:19:44 +0000,"<a href=""http://twitter.com/download/iphone"" rel=""nofollow"">Twitter for iPhone</a>",This is Keurig. He's a rare dog. Laughs like an idiot tho. Head is basically a weapon. Poorly maintained goatee 4/10 https://t.co/xOrUyj7K30,4,10,Keurig,    ,789,2499,https://pbs.twimg.com/media/CdFDQVgWIAArslx.jpg,1,Ram,51.8,False,Kuvasz,14.9,True,Great Pyrenees,10.6,True
1001,707411934438625280,2016-03-09 03:45:22 +0000,"<a href=""http://twitter.com/download/iphone"" rel=""nofollow"">Twitter for iPhone</a>","""I shall trip the big pupper with leash. Big pupper will never see it coming. I am a genius."" Both 11/10 https://t.co/uQsCJ8pf51",11,10, ,  pupper ,673,2486,https://pbs.twimg.com/media/CdE7ZktXIAEiWLj.jpg,1,Lakeland Terrier,73.8,True,Airedale,2.9,True,Giant Schnauzer,2.5,True
1002,707387676719185920,2016-03-09 02:08:59 +0000,"<a href=""http://twitter.com/download/iphone"" rel=""nofollow"">Twitter for iPhone</a>",Meet Clarkus. He's a Skinny Eastern Worcestershire. Can tie own shoes (impressive af) 10/10 would put on track team https://t.co/XP5o7zGn0E,10,10,Clarkus,    ,1490,3835,https://pbs.twimg.com/media/CdElVm7XEAADP6o.jpg,1,Chihuahua,88.8,True,Italian Greyhound,8.9,True,Toy Terrier,1.6,True
1003,707377100785885184,2016-03-09 01:26:57 +0000,"<a href=""http://twitter.com/download/iphone"" rel=""nofollow"">Twitter for iPhone</a>",This dog just brutally murdered a snowman. Currently toying with its nutritious remains 9/10 would totally still pet https://t.co/iKThgKnW1j,9,10, ,    ,1214,3603,https://pbs.twimg.com/media/CdEbt0NXIAQH3Aa.jpg,1,Golden Retriever,63.7,True,Bloodhound,9.5,True,Cocker Spaniel,7.0,True
1004,707315916783140866,2016-03-08 21:23:50 +0000,"<a href=""http://twitter.com/download/iphone"" rel=""nofollow"">Twitter for iPhone</a>",This is Finnegus. He's trapped in a snow globe. Poor pupper. 10/10 would make sure no one shook it https://t.co/BjpOa52jQ4,10,10,Finnegus,  pupper ,727,2698,https://pbs.twimg.com/media/CdDkEkHWwAAAeUJ.jpg,2,Bernese Mountain Dog,97.9,True,Shetland Sheepdog,1.1,True,Appenzeller,0.4,True
1005,707297311098011648,2016-03-08 20:09:54 +0000,"<a href=""http://twitter.com/download/iphone"" rel=""nofollow"">Twitter for iPhone</a>",This is Cassie. She can go from sweet to scary af in a matter of seconds. 10/10 points deducted for cats on pajamas https://t.co/B6dmZmJBdK,10,10,Cassie,    ,903,3022,https://pbs.twimg.com/media/CdDTJLMW4AEST--.jpg,1,Blenheim Spaniel,37.1,True,Shih-Tzu,20.2,True,Black-Footed Ferret,10.2,False
1006,707059547140169728,2016-03-08 04:25:07 +0000,"<a href=""http://twitter.com/download/iphone"" rel=""nofollow"">Twitter for iPhone</a>",Say hello to Cupcake. She's an Icelandic Dippen Dot. Confused by the oddly geometric lawn pattern. 11/10 https://t.co/D7rorf4YKL,11,10,Cupcake,    ,759,2796,https://pbs.twimg.com/media/Cc 64zVWEAAeXs7.jpg,1,Samoyed,89.7,True,Great Pyrenees,3.9,True,Kuvasz,2.0,True
1007,707038192327901184,2016-03-08 03:00:15 +0000,"<a href=""http://twitter.com/download/iphone"" rel=""nofollow"">Twitter for iPhone</a>",This is Kathmandu. He sees every move you make. Probably knows Jiu-Jitsu. 10/10 mysterious af https://t.co/z0cs7E4Xjj,10,10,Kathmandu,    ,900,2404,https://pbs.twimg.com/media/Cc ney1W4AANuY3.jpg,1,Pug,64.2,True,Llama,5.7,False,French Bulldog,5.4,True
1008,707021089608753152,2016-03-08 01:52:18 +0000,"<a href=""http://twitter.com/download/iphone"" rel=""nofollow"">Twitter for iPhone</a>",This is Tucker. He's a Dasani Episcopalian. Good lord what a tongue. 12/10 would never let go of https://t.co/gHtW5cgyy7,12,10,Tucker,    ,1540,4433,https://pbs.twimg.com/media/Cc XtkRW8AEE7Fn.jpg,2,Cocker Spaniel,56.0,True,Golden Retriever,31.5,True,Pekinese,6.7,True
1009,707014260413456384,2016-03-08 01:25:10 +0000,"<a href=""http://twitter.com/download/iphone"" rel=""nofollow"">Twitter for iPhone</a>",This is Ellie. She requests to be carried around in a lacrosse stick at all times. 11/10 impossible to say no https://t.co/15yCmd43zU,11,10,Ellie,    ,664,2502,https://pbs.twimg.com/media/Cc RsVlXEAIzzlX.jpg,1,Chihuahua,58.4,True,Italian Greyhound,13.0,True,Toy Terrier,8.9,True
1010,706901761596989440,2016-03-07 17:58:08 +0000,"<a href=""http://twitter.com/download/iphone"" rel=""nofollow"">Twitter for iPhone</a>",This is Elliot. He's blocking the roadway. Downright rude as hell. Doesn't care that you're already late. 3/10 https://t.co/FMUxir5pYu,3,10,Elliot,    ,680,2264,https://pbs.twimg.com/media/Cc9rZlBWwAA56Ra.jpg,1,Wild Boar,85.9,False,Hog,12.9,False,Warthog,1.1,False
1011,706681918348251136,2016-03-07 03:24:33 +0000,"<a href=""http://twitter.com/download/iphone"" rel=""nofollow"">Twitter for iPhone</a>",Say hello to Katie. She's a Mitsubishi Hufflepuff. Curly af. 12/10 I'd do terrible things to acquire such a pup https://t.co/CFPIcGcwJv,12,10,Katie,    ,1103,3627,https://pbs.twimg.com/media/Cc6jcYRXIAAFuox.jpg,1,Toy Poodle,71.8,True,Miniature Poodle,15.1,True,Norwich Terrier,4.7,True
1012,706644897839910912,2016-03-07 00:57:27 +0000,"<a href=""http://twitter.com/download/iphone"" rel=""nofollow"">Twitter for iPhone</a>",Meet Shadow. She's tired of the responsibilities associated with being a dog. No longer strives to attain ball. 9/10 https://t.co/cdOkfEpjFw,9,10,Shadow,    ,1224,2814,https://pbs.twimg.com/ext tw video thumb/706644797256241152/pu/img/NTqvmIUQExGmKFSR.jpg,1,Space Heater,13.8,False,Chihuahua,13.3,True,Cougar,11.4,False
1013,706593038911545345,2016-03-06 21:31:22 +0000,"<a href=""http://twitter.com/download/iphone"" rel=""nofollow"">Twitter for iPhone</a>",Here's a sneak peek of me on spring break. 10/10 so many tired pups these days https://t.co/6aJrjKfNqX,10,10, ,    ,718,2363,https://pbs.twimg.com/media/Cc5Snc7XIAAMidF.jpg,1,Four-Poster,69.6,False,Quilt,18.9,False,Pillow,2.9,False
1014,706538006853918722,2016-03-06 17:52:42 +0000,"<a href=""http://twitter.com/download/iphone"" rel=""nofollow"">Twitter for iPhone</a>","This is Oliver (pronounced ""Ricardo""). He's a ship captain. Controls these treacherous waters. 11/10 would sail with https://t.co/bxjO45rXKd",11,10,Oliver,    ,1580,3778,https://pbs.twimg.com/media/Cc4gjxqW4AIoThO.jpg,1,Chow,54.2,True,Pembroke,9.5,True,Pomeranian,8.5,True
1015,706516534877929472,2016-03-06 16:27:23 +0000,"<a href=""http://twitter.com/download/iphone"" rel=""nofollow"">Twitter for iPhone</a>",Please enjoy this pup in a cooler. Permanently ready for someone to throw a tennis ball his way. 12/10 https://t.co/KUS0xl7XIp,12,10, ,    ,1150,3404,https://pbs.twimg.com/media/Cc4NCQiXEAEx2eJ.jpg,1,Golden Retriever,77.3,True,Labrador Retriever,7.2,True,Golfcart,2.1,False
1016,706346369204748288,2016-03-06 05:11:12 +0000,"<a href=""http://twitter.com/download/iphone"" rel=""nofollow"">Twitter for iPhone</a>",This is Koda. She's a Beneboom Cumberwiggle. 12/10 petable as hell https://t.co/VZV6oMJmU6,12,10,Koda,    ,1035,3768,https://pbs.twimg.com/media/Cc1yRE2WoAAgxFQ.jpg,1,Tibetan Mastiff,95.6,True,Rottweiler,2.5,True,Appenzeller,0.9,True
1017,706310011488698368,2016-03-06 02:46:44 +0000,"<a href=""http://twitter.com/download/iphone"" rel=""nofollow"">Twitter for iPhone</a>",Here's a very sleepy pupper. Thinks it's an airplane. 12/10 would snug for eternity https://t.co/GGmcTIkBbf,12,10, ,  pupper ,9034,23443,https://pbs.twimg.com/media/Cc1RNHLW4AACG6H.jpg,1,Pembroke,69.8,True,Chihuahua,10.6,True,Bloodhound,6.2,True
1018,706291001778950144,2016-03-06 01:31:11 +0000,"<a href=""http://twitter.com/download/iphone"" rel=""nofollow"">Twitter for iPhone</a>",When you're just relaxin and having a swell time but then remember you have to fill out the FAFSA ...11/10 https://t.co/qy33OBcexg,11,10, ,    ,522,1861,https://pbs.twimg.com/media/Cc0 2tXXEAA2iTY.jpg,1,Border Terrier,58.7,True,Bull Mastiff,16.4,True,Staffordshire Bullterrier,10.5,True
1019,706265994973601792,2016-03-05 23:51:49 +0000,"<a href=""http://twitter.com/download/iphone"" rel=""nofollow"">Twitter for iPhone</a>","This is Kara. She's been trying to solve that thing for 3 days. ""I don't have thumbs,"" she said. 11/10 solid effort https://t.co/lA6a8GefrV",11,10,Kara,    ,1030,2979,https://pbs.twimg.com/media/Cc0pLU0WAAEfGEw.jpg,1,Papillon,74.4,True,Pekinese,11.4,True,Saint Bernard,4.8,True
1020,706166467411222528,2016-03-05 17:16:20 +0000,"<a href=""http://twitter.com/download/iphone"" rel=""nofollow"">Twitter for iPhone</a>",This is Dexter. He's a shy pup. Doesn't bark much. Dreadful fetcher. Has rare sun allergy. 7/10 still petable https://t.co/sA7P3JSqiv,7,10,Dexter,    ,1819,5636,https://pbs.twimg.com/media/CczOp OWoAAo5zR.jpg,1,Samoyed,43.0,True,Kuvasz,28.0,True,Great Pyrenees,11.7,True
1021,705975130514706432,2016-03-05 04:36:02 +0000,"<a href=""http://twitter.com/download/iphone"" rel=""nofollow"">Twitter for iPhone</a>",This is Adele. Her tongue flies out of her mouth at random. It's a debilitating illness. 10/10 stay strong pupper https://t.co/cfn81n3FLO,10,10,Adele,  pupper ,842,3397,https://pbs.twimg.com/media/CcwgjmuXIAEQoSd.jpg,1,Staffordshire Bullterrier,58.8,True,American Staffordshire Terrier,28.1,True,Bull Mastiff,9.5,True
1022,705970349788291072,2016-03-05 04:17:02 +0000,"<a href=""http://twitter.com/download/iphone"" rel=""nofollow"">Twitter for iPhone</a>",This is Lucy. She's a Venetian Kerploof. Supposed to be navigating. Quite irresponsible. Fancy ass collar tho 12/10 https://t.co/8tjnz1L8DI,12,10,Lucy,    ,1008,3440,https://pbs.twimg.com/media/CcwcSS9WwAALE4f.jpg,1,Golden Retriever,77.6,True,Labrador Retriever,11.2,True,Chow,3.7,True
1023,705898680587526145,2016-03-04 23:32:15 +0000,"<a href=""http://twitter.com/download/iphone"" rel=""nofollow"">Twitter for iPhone</a>",Meet Max. He's a Fallopian Cephalopuff. Eyes are magical af. Lil dandruff problem. No big deal 10/10 would still pet https://t.co/c67nUjwmFs,10,10,Max,    ,643,2597,https://pbs.twimg.com/media/CcvbGj5W8AARjB6.jpg,1,Collie,80.8,True,Border Collie,5.9,True,Groenendael,2.7,True
1024,705786532653883392,2016-03-04 16:06:36 +0000,"<a href=""http://twitter.com/download/iphone"" rel=""nofollow"">Twitter for iPhone</a>","Seriously, add us ðŸ¶ 11/10 for sad wet pupper https://t.co/xwPE9faVZR",11,10, ,  pupper ,596,2132,https://pbs.twimg.com/media/Cct1G6vVAAI9ZjF.jpg,1,Web Site,55.0,False,Labrador Retriever,14.8,True,Golden Retriever,14.8,True
1025,705591895322394625,2016-03-04 03:13:11 +0000,"<a href=""http://twitter.com/download/iphone"" rel=""nofollow"">Twitter for iPhone</a>","""Ma'am, for the last time, I'm not authorized to make that type of transaction"" 11/10 https://t.co/nPTBsdm3BF",11,10, ,    ,1308,3475,https://pbs.twimg.com/media/CcrEFQdUcAA7CJf.jpg,1,Basenji,87.7,True,Italian Greyhound,4.8,True,Miniature Pinscher,3.6,True
1026,705475953783398401,2016-03-03 19:32:29 +0000,"<a href=""http://twitter.com/download/iphone"" rel=""nofollow"">Twitter for iPhone</a>",Say hello to Zara. She found a sandal and couldn't be happier. 12/10 great work https://t.co/zQUuVu812n,12,10,Zara,    ,1045,3231,https://pbs.twimg.com/media/CcpaoR9WAAAKlJJ.jpg,1,Golden Retriever,90.9,True,Labrador Retriever,3.0,True,Tennis Ball,0.5,False
1027,705442520700944385,2016-03-03 17:19:38 +0000,"<a href=""http://twitter.com/download/iphone"" rel=""nofollow"">Twitter for iPhone</a>",This is Cooper. He only wakes up to switch gears. 12/10 helpful af https://t.co/EEIkAGVY64,12,10,Cooper,    ,1859,4877,https://pbs.twimg.com/media/Cco8OmOXIAE0aCu.jpg,1,Great Pyrenees,30.9,True,Kuvasz,22.5,True,Seat Belt,20.2,False
1028,705428427625635840,2016-03-03 16:23:38 +0000,"<a href=""http://twitter.com/download/iphone"" rel=""nofollow"">Twitter for iPhone</a>",This is Ambrose. He's an Alfalfa Ballyhoo. Draws pistol fast af. Pretty much runs the frontier. 11/10 lethal pupper https://t.co/ih6epBOxIA,11,10,Ambrose,  pupper ,1931,4188,https://pbs.twimg.com/media/CcovaMUXIAApFDl.jpg,1,Chihuahua,77.5,True,Quilt,7.3,False,Pembroke,2.2,True
1029,705239209544720384,2016-03-03 03:51:44 +0000,"<a href=""http://twitter.com/download/iphone"" rel=""nofollow"">Twitter for iPhone</a>",This is Jimothy. He lost his body during the the Third Crusade (tragic). 11/10 heroic af tho https://t.co/wnsblfu7XE,11,10,Jimothy,    ,854,3290,https://pbs.twimg.com/media/CcmDUjFW8AAqAjc.jpg,1,Chihuahua,15.8,True,Toy Terrier,9.0,True,Mexican Hairless,6.3,True
1030,705223444686888960,2016-03-03 02:49:06 +0000,"<a href=""http://twitter.com/download/iphone"" rel=""nofollow"">Twitter for iPhone</a>",This is Bode. He's a heavy sleeper. 9/10 https://t.co/YMkxhGWUqv,9,10,Bode,    ,900,2829,https://pbs.twimg.com/media/Ccl0-HVVAAAf8aK.jpg,1,Egyptian Cat,9.1,False,Chesapeake Bay Retriever,7.7,True,Mexican Hairless,4.9,True
1031,705102439679201280,2016-03-02 18:48:16 +0000,"<a href=""http://twitter.com/download/iphone"" rel=""nofollow"">Twitter for iPhone</a>",This is Terrenth. He just stubbed his toe. 10/10 deep breaths Terrenth https://t.co/Pg18CDFC7Z,10,10,Terrenth,    ,585,2342,https://pbs.twimg.com/media/CckG63qUsAALbIr.jpg,1,Collie,45.8,True,Chow,27.9,True,Pomeranian,7.7,True
1032,705066031337840642,2016-03-02 16:23:36 +0000,"<a href=""http://twitter.com/download/iphone"" rel=""nofollow"">Twitter for iPhone</a>",This is Reese. He's a Chilean Sohcahtoa. Loves to swing. Never sure what to do with his feet. 12/10 huggable af https://t.co/VA6jnNUyuW,12,10,Reese,    ,683,2378,https://pbs.twimg.com/media/CcjlzRkW0AMqmWg.jpg,1,Airedale,86.9,True,Irish Terrier,2.8,True,Otterhound,2.5,True
1033,704871453724954624,2016-03-02 03:30:25 +0000,"<a href=""http://twitter.com/download/iphone"" rel=""nofollow"">Twitter for iPhone</a>",I found a forest Pipsy. 12/10 https://t.co/mIQ1KoVsmU,12,10, ,    ,1245,4585,https://pbs.twimg.com/media/Ccg02LiWEAAJHw1.jpg,1,Norfolk Terrier,69.0,True,Soft-Coated Wheaten Terrier,10.1,True,Norwich Terrier,5.6,True
1034,704859558691414016,2016-03-02 02:43:09 +0000,"<a href=""http://twitter.com/download/iphone"" rel=""nofollow"">Twitter for iPhone</a>",Here is a heartbreaking scene of an incredible pupper being laid to rest. 10/10 RIP pupper https://t.co/81mvJ0rGRu,10,10, ,  pupper ,612,2462,https://pbs.twimg.com/media/CcgqBNVW8AE76lv.jpg,1,Pug,28.4,True,Teddy,15.6,False,Mitten,13.9,False
1035,704847917308362754,2016-03-02 01:56:53 +0000,"<a href=""http://twitter.com/download/iphone"" rel=""nofollow"">Twitter for iPhone</a>","""Yes hi could I get a number 4 with no pickles"" ...12/10 https://t.co/kQPVxqA3gq",12,10, ,    ,1727,5594,https://pbs.twimg.com/media/CcgfcANW4AA9hzr.jpg,1,Golden Retriever,85.7,True,Labrador Retriever,13.5,True,Tibetan Mastiff,0.2,True
1036,704819833553219584,2016-03-02 00:05:17 +0000,"<a href=""http://twitter.com/download/iphone"" rel=""nofollow"">Twitter for iPhone</a>",This is Chesterson. He's a Bolivian Scoop Dog. Incredibly portable. Can't bark for shit tho. 7/10 would still pet https://t.co/EatAd8JhyW,7,10,Chesterson,    ,1136,2906,https://pbs.twimg.com/media/CcgF5ovW8AACrEU.jpg,1,Guinea Pig,99.5,False,Hamster,0.4,False,Wood Rabbit,0.0,False
1037,704761120771465216,2016-03-01 20:11:59 +0000,"<a href=""http://twitter.com/download/iphone"" rel=""nofollow"">Twitter for iPhone</a>",This pupper killed this great white in an epic sea battle. Now wears it as a trophy. Such brave. Much fierce. 13/10 https://t.co/Lu0ECu5tO5,13,10, ,  pupper ,3257,7283,https://pbs.twimg.com/media/CcfQgHVWoAAxauy.jpg,1,Siamese Cat,20.2,False,Chihuahua,10.0,True,Basenji,7.2,True
1038,704499785726889984,2016-03-01 02:53:32 +0000,"<a href=""http://twitter.com/download/iphone"" rel=""nofollow"">Twitter for iPhone</a>",When you wake up from a long nap and have no idea who you are. 12/10 https://t.co/dlF93GLnDc,12,10, ,    ,1124,3212,https://pbs.twimg.com/media/Ccbi0UGWoAA4fwg.jpg,1,Chihuahua,37.7,True,Siamese Cat,9.8,False,Labrador Retriever,8.5,True
1039,704480331685040129,2016-03-01 01:36:14 +0000,"<a href=""http://twitter.com/download/iphone"" rel=""nofollow"">Twitter for iPhone</a>",Meet Lucia. She's a Cumulonimbus Floofmallow. Only has two legs tho (unfortunate). 11/10 would definitely still pet https://t.co/qv6qlEUCEe,11,10,Lucia,    ,1197,3723,https://pbs.twimg.com/media/CcbRIAgXIAQaKHQ.jpg,1,Samoyed,97.9,True,Pomeranian,0.7,True,Arctic Fox,0.6,False
1040,704364645503647744,2016-02-29 17:56:32 +0000,"<a href=""http://twitter.com/download/iphone"" rel=""nofollow"">Twitter for iPhone</a>",Say hello to Bisquick. He's a Beneplop Cumbersnug. Even smiles when wet. 12/10 I'd steal Bisquick https://t.co/5zX5XD3i6K,12,10,Bisquick,    ,3999,8804,https://pbs.twimg.com/media/CcZn6RWWIAAmOZG.jpg,1,Pembroke,98.1,True,Cardigan,1.9,True,Chihuahua,0.0,True
1041,704347321748819968,2016-02-29 16:47:42 +0000,"<a href=""http://twitter.com/download/iphone"" rel=""nofollow"">Twitter for iPhone</a>",This is Ralphson. He's very confused. Wondering why he's sitting on Santa's lap in February. 10/10 stay woke pupper https://t.co/INphk4ltkZ,10,10,Ralphson,  pupper ,393,1729,https://pbs.twimg.com/media/CcZYJniXEAAEJRF.jpg,1,Teddy,23.3,False,Feather Boa,8.8,False,Brittany Spaniel,8.3,True
1042,704113298707505153,2016-02-29 01:17:46 +0000,"<a href=""http://twitter.com/download/iphone"" rel=""nofollow"">Twitter for iPhone</a>",Meet Stanley. He's an inverted Uzbekistani water pup. Hella exotic. Floats around all day. 8/10 I want to be Stanley https://t.co/XpYMBQ1FD8,8,10,Stanley,    ,629,2031,https://pbs.twimg.com/media/CcWDTerUAAALORn.jpg,2,Otter,94.6,False,Mink,1.8,False,Sea Lion,1.6,False
1043,704054845121142784,2016-02-28 21:25:30 +0000,"<a href=""http://twitter.com/download/iphone"" rel=""nofollow"">Twitter for iPhone</a>",Here is a whole flock of puppers.  60/50 I'll take the lot https://t.co/9dpcw6MdWa,60,50, ,    ,1028,3201,https://pbs.twimg.com/media/CcVOJEcXEAM0FHL.jpg,1,Great Pyrenees,66.8,True,Kuvasz,22.9,True,Golden Retriever,4.4,True
1044,703774238772166656,2016-02-28 02:50:28 +0000,"<a href=""http://twitter.com/download/iphone"" rel=""nofollow"">Twitter for iPhone</a>","""YOU CAN'T HANDLE THE TRUTH"" both 10/10 https://t.co/ZvxdB4i9AG",10,10, ,    ,526,2020,https://pbs.twimg.com/media/CcRO8FmW4AAzazk.jpg,1,Labrador Retriever,99.0,True,Chesapeake Bay Retriever,0.8,True,Curly-Coated Retriever,0.1,True
1045,703769065844768768,2016-02-28 02:29:55 +0000,"<a href=""http://twitter.com/download/iphone"" rel=""nofollow"">Twitter for iPhone</a>",When you're trying to watch your favorite tv show but your friends keep interrupting. 10/10 relatable af https://t.co/QQZDCYl6zT,10,10, ,    ,1276,3621,https://pbs.twimg.com/media/CcRKOzyXEAQO HN.jpg,2,Boxer,83.9,True,Greater Swiss Mountain Dog,8.9,True,Bull Mastiff,3.2,True
1046,703631701117943808,2016-02-27 17:24:05 +0000,"<a href=""http://twitter.com/download/iphone"" rel=""nofollow"">Twitter for iPhone</a>",This is Bella. Based on this picture she's at least 8ft tall (wow)! Must be rare. 11/10 would pet on tippy toes https://t.co/XTVbSRdvcp,11,10,Bella,    ,772,2853,https://pbs.twimg.com/media/CcPNS4yW8AAd-Et.jpg,2,Window Shade,91.0,False,Window Screen,1.1,False,Brass,0.9,False
1047,703611486317502464,2016-02-27 16:03:45 +0000,"<a href=""http://twitter.com/download/iphone"" rel=""nofollow"">Twitter for iPhone</a>",Meet Scooter. He's experiencing the pupper equivalent of dropping ur phone in a toilet 10/10 put it in some rice pup https://t.co/JSmX1FIEaW,10,10,Scooter,  pupper ,1709,4229,https://pbs.twimg.com/media/CcO66OjXEAASXmH.jpg,1,Pembroke,75.6,True,Basenji,12.7,True,Cardigan,8.0,True
