,tweet_id,timestamp,source,text,rating_numerator,rating_denominator,pet_name,stage,retweet_count,favorite_count,image_url,image_number,first_prediction,first_prediction_confidence(%),first_prediction_is_dog,second_prediction,second_prediction_confidence(%),second_prediction_is_dog,third_prediction,third_prediction_confidence(%),third_prediction_is_dog
1428,677673981332312066,2015-12-18 02:17:22 +0000,"<a href=""http://twitter.com/download/iphone"" rel=""nofollow"">Twitter for iPhone</a>",Endangered triangular pup here. Could be a wizard. Caught mid-laugh. No legs. Just fluff. Probably a wizard. 9/10 https://t.co/GFVIHIod0Z,9,10, ,    ,1677,3603,https://pbs.twimg.com/media/CWeU5LBWEAA8F0J.jpg,1,Maltese Dog,81.8,True,Angora,7.8,False,Pomeranian,2.2,True
1429,677662372920729601,2015-12-18 01:31:14 +0000,"<a href=""http://twitter.com/download/iphone"" rel=""nofollow"">Twitter for iPhone</a>","In honor of the new Star Wars movie. Here's Yoda pug. 12/10 pet really well, would I https://t.co/pvjdRn00XH",12,10, ,    ,1101,2134,https://pbs.twimg.com/media/CWeKTZTWsAA5R3Z.jpg,1,Cowboy Hat,25.6,False,Trench Coat,12.7,False,Cloak,7.1,False
1430,677644091929329666,2015-12-18 00:18:36 +0000,"<a href=""http://twitter.com/download/iphone"" rel=""nofollow"">Twitter for iPhone</a>",This is a dog swinging. I really enjoyed it so I hope you all do as well. 11/10 https://t.co/Ozo9KHTRND,11,10, ,    ,886,2040,https://pbs.twimg.com/ext tw video thumb/677644010865999872/pu/img/zVHEMYnJKzq1SauT.jpg,1,Chihuahua,62.6,True,Italian Greyhound,12.8,True,Swing,6.0,False
1431,677573743309385728,2015-12-17 19:39:03 +0000,"<a href=""http://twitter.com/download/iphone"" rel=""nofollow"">Twitter for iPhone</a>",This is Sandy. He's sexually confused. Thinks he's a pigeon. Also an All-American cheese catcher. 10/10 so petable https://t.co/Htu8plSqEu,10,10,Sandy,    ,819,2322,https://pbs.twimg.com/media/CWc5uVPXIAErLYr.jpg,2,Patio,53.5,False,Folding Chair,8.0,False,Parallel Bars,3.5,False
1432,677565715327688705,2015-12-17 19:07:09 +0000,"<a href=""http://twitter.com/download/iphone"" rel=""nofollow"">Twitter for iPhone</a>",Contortionist pup here. Inside pentagram. Clearly worships Satan. Known to slowly push fragile stuff off tables 6/10 https://t.co/EX9oR55VMe,6,10, ,    ,513,1409,https://pbs.twimg.com/media/CWcybBmWcAAigAQ.jpg,1,Basset,39.7,True,Welsh Springer Spaniel,20.0,True,Purse,10.6,False
1433,677557565589463040,2015-12-17 18:34:46 +0000,"<a href=""http://twitter.com/download/iphone"" rel=""nofollow"">Twitter for iPhone</a>",Reckless pupper here. Not even looking at road. Absolute menace. No regard for fellow pupper lives. 10/10 still cute https://t.co/96IBkOYB7j,10,10, ,  pupper ,1322,2665,https://pbs.twimg.com/media/CWcrAVQWEAA6QMp.jpg,1,Seat Belt,27.7,False,Shih-Tzu,24.9,True,Pekinese,20.9,True
1434,677547928504967168,2015-12-17 17:56:29 +0000,"<a href=""http://twitter.com/download/iphone"" rel=""nofollow"">Twitter for iPhone</a>",Not much to say here. I just think everyone needs to see this. 12/10 https://t.co/AGag0hFHpe,12,10, ,    ,4076,7568,https://pbs.twimg.com/media/CWciPonWEAUOqLD.jpg,1,American Staffordshire Terrier,91.5,True,Staffordshire Bullterrier,8.4,True,Boxer,0.0,True
1435,677530072887205888,2015-12-17 16:45:31 +0000,"<a href=""http://twitter.com/download/iphone"" rel=""nofollow"">Twitter for iPhone</a>",Say hello to Axel. He's a Black Chevy Pinot on wheels. 0 to 60 in 5.7 seconds (if downhill). 9/10 I call shotgun https://t.co/DKe9DBnnHE,9,10,Axel,    ,250,1161,https://pbs.twimg.com/media/CWcSAI-WUAAOB9W.jpg,1,Staffordshire Bullterrier,68.9,True,Norwegian Elkhound,2.6,True,American Staffordshire Terrier,2.3,True
1436,677334615166730240,2015-12-17 03:48:51 +0000,"<a href=""http://twitter.com/download/iphone"" rel=""nofollow"">Twitter for iPhone</a>",This dog gave up mid jump. 9/10 https://t.co/KmMv3Y2zI8,9,10, ,    ,328,1477,https://pbs.twimg.com/media/CWZgPPUWUAAUOvu.jpg,2,Lakeland Terrier,85.9,True,Airedale,6.7,True,Irish Water Spaniel,5.0,True
1437,677331501395156992,2015-12-17 03:36:28 +0000,"<a href=""http://twitter.com/download/iphone"" rel=""nofollow"">Twitter for iPhone</a>",Meet Humphrey. He's a Northern Polyp Viagra. One ear works. Face stuck like that. Always surprised. 9/10 petable af https://t.co/FS7eJQM2F4,9,10,Humphrey,    ,265,1189,https://pbs.twimg.com/media/CWZdaGxXAAAjGjb.jpg,1,Beagle,31.3,True,Boxer,21.9,True,French Bulldog,10.6,True
1438,677328882937298944,2015-12-17 03:26:04 +0000,"<a href=""http://twitter.com/download/iphone"" rel=""nofollow"">Twitter for iPhone</a>",This is Derek. All the dogs adore Derek. He's a great guy. 10/10 really solid pup https://t.co/KgcsGNb61s,10,10,Derek,    ,1693,3938,https://pbs.twimg.com/media/CWZbBlAUsAAjRg5.jpg,1,Water Buffalo,42.4,False,Kelpie,2.9,True,Staffordshire Bullterrier,2.8,True
1439,677314812125323265,2015-12-17 02:30:09 +0000,"<a href=""http://twitter.com/download/iphone"" rel=""nofollow"">Twitter for iPhone</a>","Meet Tassy &amp; Bee. Tassy is pretty chill, but Bee is convinced the Ruffles are haunted. 10/10 &amp; 11/10 respectively https://t.co/fgORpmTN9C",10,10,Tassy,    ,611,1799,https://pbs.twimg.com/media/CWZOOIUW4AAQrX .jpg,2,Blenheim Spaniel,92.4,True,Japanese Spaniel,5.5,True,Chihuahua,0.8,True
1440,677301033169788928,2015-12-17 01:35:24 +0000,"<a href=""http://twitter.com/download/iphone"" rel=""nofollow"">Twitter for iPhone</a>",This is Juckson. He's totally on his way to a nascar race. 5/10 for Juckson https://t.co/IoLRvF0Kak,5,10,Juckson,    ,471,1362,https://pbs.twimg.com/media/CWZBsjPWsAAZFFl.jpg,1,Japanese Spaniel,66.1,True,Pekinese,15.0,True,Chihuahua,12.0,True
1441,677269281705472000,2015-12-16 23:29:14 +0000,"<a href=""http://twitter.com/download/iphone"" rel=""nofollow"">Twitter for iPhone</a>",This is the happiest pupper I've ever seen. 10/10 would trade lives with https://t.co/ep8ATEJwRb,10,10, ,  pupper ,790,2164,https://pbs.twimg.com/media/CWYk0WxWoAAEwRt.jpg,1,Shetland Sheepdog,65.7,True,Collie,19.5,True,German Shepherd,1.3,True
1442,677228873407442944,2015-12-16 20:48:40 +0000,"<a href=""http://twitter.com/download/iphone"" rel=""nofollow"">Twitter for iPhone</a>",Say hello to Chuq. He just wants to fit in. 11/10 https://t.co/hGkMCjZzn4,11,10,Chuq,    ,1840,3837,https://pbs.twimg.com/media/CWYAEINW4AIuw8P.jpg,1,Common Iguana,56.6,False,Tennis Ball,15.5,False,Green Lizard,4.5,False
1443,677187300187611136,2015-12-16 18:03:28 +0000,"<a href=""http://twitter.com/download/iphone"" rel=""nofollow"">Twitter for iPhone</a>",Here we see a Byzantine Rigatoni. Very aerodynamic. No eyes. Actually not windy here they just look like that. 9/10 https://t.co/gzI0m6wXRo,9,10, ,    ,1033,2981,https://pbs.twimg.com/media/CWXaQMBWcAAATDi.jpg,1,English Setter,28.2,True,Shih-Tzu,8.4,True,Old English Sheepdog,6.0,True
1444,676975532580409345,2015-12-16 04:01:59 +0000,"<a href=""http://twitter.com/download/iphone"" rel=""nofollow"">Twitter for iPhone</a>",This is Cooper. He doesn't know how cheese works. Likes the way it feels on his face. Cheeky tongue slip. 11/10 https://t.co/j1zczS0lI5,11,10,Cooper,    ,1203,3015,https://pbs.twimg.com/media/CWUZpydWcAAeipD.jpg,1,Malamute,36.3,True,Siberian Husky,24.6,True,Eskimo Dog,12.6,True
1445,676957860086095872,2015-12-16 02:51:45 +0000,"<a href=""http://twitter.com/download/iphone"" rel=""nofollow"">Twitter for iPhone</a>",10/10 I'd follow this dog into battle no questions asked https://t.co/ngTNXYQF0L,10,10, ,    ,907,2395,https://pbs.twimg.com/ext tw video thumb/676957802976419840/pu/img/dCj-qlXo73A5hf6Q.jpg,1,Labrador Retriever,77.2,True,Beagle,5.6,True,Golden Retriever,3.1,True
1446,676949632774234114,2015-12-16 02:19:04 +0000,"<a href=""http://twitter.com/download/iphone"" rel=""nofollow"">Twitter for iPhone</a>",This is Tyrus. He's a Speckled Centennial Ticonderoga. Terrified of floating red ball. Nifty bandana. 8/10 v petable https://t.co/HqM3YhCaaa,8,10,Tyrus,    ,448,1413,https://pbs.twimg.com/media/CWUCGMtWEAAjXnS.jpg,1,Welsh Springer Spaniel,20.6,True,Saint Bernard,13.9,True,Boxer,11.5,True
1447,676948236477857792,2015-12-16 02:13:31 +0000,"<a href=""http://twitter.com/download/iphone"" rel=""nofollow"">Twitter for iPhone</a>",This is Karl. Karl thinks he's slick. 6/10 sneaky pup https://t.co/Lo4ALwjVh4,6,10,Karl,    ,980,2354,https://pbs.twimg.com/media/CWUA1GFW4AAowiq.jpg,1,Guenon,61.2,False,Macaque,13.5,False,Squirrel Monkey,8.3,False
1448,676946864479084545,2015-12-16 02:08:04 +0000,"<a href=""http://twitter.com/download/iphone"" rel=""nofollow"">Twitter for iPhone</a>",This pups goal was to get all four feet as close to each other as possible. Valiant effort 12/10 https://t.co/2mXALbgBTV,12,10, ,    ,426,1844,https://pbs.twimg.com/media/CWT lOQWUAAXPaY.jpg,1,Pekinese,75.3,True,Golden Retriever,5.6,True,Great Pyrenees,4.1,True
1449,676942428000112642,2015-12-16 01:50:26 +0000,"<a href=""http://twitter.com/download/iphone"" rel=""nofollow"">Twitter for iPhone</a>",Who leaves the last cupcake just sitting there? 9/10 https://t.co/PWMqAoEx2a,9,10, ,    ,855,2261,https://pbs.twimg.com/media/CWT7imQXIAMwpQ2.jpg,1,Black-Footed Ferret,70.7,False,Polecat,15.5,False,Weasel,9.8,False
1450,676936541936185344,2015-12-16 01:27:03 +0000,"<a href=""http://twitter.com/download/iphone"" rel=""nofollow"">Twitter for iPhone</a>",Here we see a rare pouched pupper. Ample storage space. Looks alert. Jumps at random. Kicked open that door. 8/10 https://t.co/mqvaxleHRz,8,10, ,  pupper ,5515,13809,https://pbs.twimg.com/media/CWT2MUgWIAECWig.jpg,1,Chesapeake Bay Retriever,54.5,True,Norwegian Elkhound,8.1,True,Space Heater,4.7,False
1451,676897532954456065,2015-12-15 22:52:02 +0000,"<a href=""http://twitter.com/download/iphone"" rel=""nofollow"">Twitter for iPhone</a>",Exotic handheld dog here. Appears unathletic. Feet look deadly. Can be thrown a great distance. 5/10 might pet idk https://t.co/Avq4awulqk,5,10, ,    ,817,2426,https://pbs.twimg.com/media/CWTSt0UW4AALMNB.jpg,1,Hamster,62.8,False,Guinea Pig,31.9,False,Macaque,1.3,False
1452,676864501615042560,2015-12-15 20:40:47 +0000,"<a href=""http://twitter.com/download/iphone"" rel=""nofollow"">Twitter for iPhone</a>",Meet Ash. He's just a head now. Lost his body during the Third Crusade. Still in good spirits. 10/10 would pet well https://t.co/NJj2uP0atK,10,10,Ash,    ,808,2294,https://pbs.twimg.com/media/CWS0q8iU8AE2Srr.jpg,1,Chesapeake Bay Retriever,37.1,True,Water Buffalo,10.0,False,Weimaraner,4.9,True
1453,676821958043033607,2015-12-15 17:51:44 +0000,"<a href=""http://twitter.com/download/iphone"" rel=""nofollow"">Twitter for iPhone</a>",Finally some constructive political change in this country. 11/10 https://t.co/mvQaETHVSb,11,10, ,    ,17605,25124,https://pbs.twimg.com/media/CWSN-vaXAAA8Ehr.jpg,2,Great Pyrenees,87.0,True,Kuvasz,8.0,True,Standard Poodle,1.3,True
1454,676819651066732545,2015-12-15 17:42:34 +0000,"<a href=""http://twitter.com/download/iphone"" rel=""nofollow"">Twitter for iPhone</a>",Watch out Airbud. This pupper is also good at the sports. 12/10 I'm thinking D1 https://t.co/1HrFdo7M0C,12,10, ,  pupper ,741,1957,https://pbs.twimg.com/media/CWSL4W8WsAAE4KU.jpg,2,Rain Barrel,62.6,False,Barrel,13.8,False,Labrador Retriever,3.9,True
1455,676811746707918848,2015-12-15 17:11:09 +0000,"<a href=""http://twitter.com/download/iphone"" rel=""nofollow"">Twitter for iPhone</a>",Say hello to Penny &amp; Gizmo. They are practicing their caroling. The ambition in the room is tangible. 9/10 for both https://t.co/aqBHjjh5VD,9,10,Penny,    ,469,1536,https://pbs.twimg.com/media/CWSEsO9WwAAX-fZ.jpg,1,Chihuahua,44.1,True,Pomeranian,34.6,True,Cocker Spaniel,6.0,True
1456,676776431406465024,2015-12-15 14:50:49 +0000,"<a href=""http://twitter.com/download/iphone"" rel=""nofollow"">Twitter for iPhone</a>","When someone yells ""cops!"" at a party and you gotta get your drunk friend out of there. 10/10 https://t.co/4rMZi5Ca1k",10,10, ,    ,2249,5405,https://pbs.twimg.com/ext tw video thumb/676776408941662209/pu/img/k-6I3YEZAQtYPBXR.jpg,1,Doormat,20.1,False,Dishwasher,19.2,False,Microwave,3.8,False
1457,676617503762681856,2015-12-15 04:19:18 +0000,"<a href=""http://twitter.com/download/iphone"" rel=""nofollow"">Twitter for iPhone</a>",I promise this wasn't meant to be a cuteness overload account but ermergerd look at this cozy pupper. 13/10 https://t.co/mpQl2rJjDh,13,10, ,  pupper ,1108,3149,https://pbs.twimg.com/media/CWPUB9TWwAALPPx.jpg,1,Chihuahua,84.1,True,Pomeranian,12.1,True,Pekinese,0.7,True
1458,676613908052996102,2015-12-15 04:05:01 +0000,"<a href=""http://twitter.com/download/iphone"" rel=""nofollow"">Twitter for iPhone</a>",This is the saddest/sweetest/best picture I've been sent. 12/10 ðŸ˜¢ðŸ¶ https://t.co/vQ2Lw1BLBF,12,10, ,    ,219,1183,https://pbs.twimg.com/media/CWPQwmJWUAAu At.jpg,1,Book Jacket,49.4,False,Doberman,9.6,True,Miniature Pinscher,7.1,True
1459,676606785097199616,2015-12-15 03:36:42 +0000,"<a href=""http://twitter.com/download/iphone"" rel=""nofollow"">Twitter for iPhone</a>",*screeches for a sec and then faints* 12/10 https://t.co/N5QL4ySBEx,12,10, ,    ,490,2039,https://pbs.twimg.com/media/CWPKSGpWcAQN6mw.jpg,1,Loafer,20.3,False,Doormat,20.0,False,Malinois,14.2,True
1460,676603393314578432,2015-12-15 03:23:14 +0000,"<a href=""http://twitter.com/download/iphone"" rel=""nofollow"">Twitter for iPhone</a>",This is Godzilla pupper. He had a ruff childhood &amp; now deflects that pain outward by terrorizing cities. Tragic 9/10 https://t.co/g1tLGkyaxr,9,10,Godzilla,  pupper ,440,1280,https://pbs.twimg.com/media/CWPHMqKVAAAE78E.jpg,1,Whippet,87.7,True,Great Dane,3.4,True,Boxer,2.8,True
1461,676588346097852417,2015-12-15 02:23:26 +0000,"<a href=""http://twitter.com/download/iphone"" rel=""nofollow"">Twitter for iPhone</a>",This is Bubbles. He kinda resembles a fish. Always makes eye contact with u no matter what. Sneaky tongue slip. 5/10 https://t.co/Nrhvc5tLFT,5,10,Bubbles,    ,896,2533,https://pbs.twimg.com/media/CWO5gmCUYAAX4WA.jpg,1,Boston Bull,97.7,True,French Bulldog,1.4,True,Chihuahua,0.2,True
1462,676582956622721024,2015-12-15 02:02:01 +0000,"<a href=""http://twitter.com/download/iphone"" rel=""nofollow"">Twitter for iPhone</a>","Meet Vinnie. He's having fun while being safe. Well not a lot of fun, but definitely safe, and that's important 8/10 https://t.co/vZYtynZZlH",8,10,Vinnie,    ,312,1310,https://pbs.twimg.com/media/CWO0m8tUwAAB901.jpg,1,Seat Belt,79.0,False,Boston Bull,19.6,True,French Bulldog,1.2,True
1463,676575501977128964,2015-12-15 01:32:24 +0000,"<a href=""http://twitter.com/download/iphone"" rel=""nofollow"">Twitter for iPhone</a>",This pupper is very passionate about Christmas. Wanted to give the tree a hug. So cute. 8/10 https://t.co/NsGyECJuq7,8,10, ,  pupper ,1254,2807,https://pbs.twimg.com/media/CWOt07EUsAAnOYW.jpg,1,Feather Boa,42.4,False,Yorkshire Terrier,7.3,True,Shetland Sheepdog,5.8,True
1464,676533798876651520,2015-12-14 22:46:41 +0000,"<a href=""http://twitter.com/download/iphone"" rel=""nofollow"">Twitter for iPhone</a>",ITSOFLUFFAYYYYY 12/10 https://t.co/bfw13CnuuZ,12,10, ,    ,621,2025,https://pbs.twimg.com/media/CWOH4s9U8AEtkmQ.jpg,1,Chow,26.5,True,Ice Bear,16.8,False,Fur Coat,11.8,False
1465,676496375194980353,2015-12-14 20:17:59 +0000,"<a href=""http://twitter.com/download/iphone"" rel=""nofollow"">Twitter for iPhone</a>",Say hello to Griffin. He's upset because his costume for Halloween didn't arrive until today. 9/10 cheer up pup https://t.co/eoBCjSFajX,9,10,Griffin,    ,602,1641,https://pbs.twimg.com/media/CWNl3S9WcAARN34.jpg,1,Pug,98.5,True,Norwegian Elkhound,0.4,True,French Bulldog,0.4,True
1466,676470639084101634,2015-12-14 18:35:43 +0000,"<a href=""http://twitter.com/download/iphone"" rel=""nofollow"">Twitter for iPhone</a>",Three generations of pupper. 11/10 for all https://t.co/tAmQYvzrau,11,10, ,  pupper ,5224,12616,https://pbs.twimg.com/media/CWNOdIpWoAAWid2.jpg,1,Golden Retriever,79.0,True,Borzoi,2.3,True,Dingo,1.5,False
1467,676440007570247681,2015-12-14 16:34:00 +0000,"<a href=""http://twitter.com/download/iphone"" rel=""nofollow"">Twitter for iPhone</a>",Hope your Monday isn't too awful. Here's two baseball puppers. 11/10 for each https://t.co/dB0H9hdZai,11,10, ,    ,748,1863,https://pbs.twimg.com/media/CWMyl9EWUAAnZJ0.jpg,2,Maltese Dog,57.9,True,Toy Poodle,13.3,True,Shih-Tzu,9.4,True
1468,676430933382295552,2015-12-14 15:57:56 +0000,"<a href=""http://twitter.com/download/iphone"" rel=""nofollow"">Twitter for iPhone</a>","Meet Duke. He's an Urban Parmesan. They know he's scared of the green rubber dog. ""Why u do dis?"" thinks Duke. 10/10 https://t.co/3bim9U5Idr",10,10,Duke,    ,385,1526,https://pbs.twimg.com/media/CWMqV7WUYAEEClG.jpg,1,Golden Retriever,58.4,True,Cocker Spaniel,20.4,True,Labrador Retriever,3.6,True
1469,676263575653122048,2015-12-14 04:52:55 +0000,"<a href=""http://twitter.com/download/iphone"" rel=""nofollow"">Twitter for iPhone</a>",All this pupper wanted to do was go skiing. No one told him about the El NiÃ±o. Poor pupper. 10/10 maybe next year https://t.co/fTgbq1UBR9,10,10, ,  pupper ,609,2243,https://pbs.twimg.com/media/CWKSIfUUYAAiOBO.jpg,1,Teddy,9.8,False,Toy Poodle,9.8,True,Shopping Basket,7.8,False
1470,676237365392908289,2015-12-14 03:08:46 +0000,"<a href=""http://twitter.com/download/iphone"" rel=""nofollow"">Twitter for iPhone</a>",Say hello to Winston. He has no respect for the system. Much rebellion. I think that's a palm tree... nice. 8/10 https://t.co/dOLQddhXLZ,8,10,Winston,    ,331,1335,https://pbs.twimg.com/media/CWJ6Sc-WwAAlpI6.jpg,1,French Bulldog,96.2,True,Chihuahua,2.2,True,Boston Bull,0.7,True
1471,676219687039057920,2015-12-14 01:58:31 +0000,"<a href=""http://twitter.com/download/iphone"" rel=""nofollow"">Twitter for iPhone</a>",This is Kenneth. He's stuck in a bubble. 10/10 hang in there Kenneth https://t.co/uQt37xlYMJ,10,10,Kenneth,    ,31989,67100,https://pbs.twimg.com/media/CWJqN9iWwAAg86R.jpg,1,Bubble,99.8,False,Leafhopper,0.0,False,Whippet,0.0,True
1472,676215927814406144,2015-12-14 01:43:35 +0000,"<a href=""http://twitter.com/download/iphone"" rel=""nofollow"">Twitter for iPhone</a>",This is Herm. He just wants to be like the other dogs. Sneaky tongue slip. Super fuzzy. 9/10 would cuddle firmly https://t.co/tg8h9lzCHv,9,10,Herm,    ,661,1881,https://pbs.twimg.com/media/CWJmzNsWUAE706Z.jpg,1,Hamster,99.9,False,Guinea Pig,0.0,False,Broccoli,0.0,False
1473,676191832485810177,2015-12-14 00:07:50 +0000,"<a href=""http://twitter.com/download/iphone"" rel=""nofollow"">Twitter for iPhone</a>",These two pups just met and have instantly bonded. Spectacular scene. Mesmerizing af. 10/10 and 7/10 for blue dog https://t.co/gwryaJO4tC,10,10, ,    ,1145,2478,https://pbs.twimg.com/media/CWJQ4UmWoAIJ29t.jpg,2,Chihuahua,37.7,True,Italian Greyhound,17.3,True,Muzzle,7.1,False
1474,676146341966438401,2015-12-13 21:07:04 +0000,"<a href=""http://twitter.com/download/iphone"" rel=""nofollow"">Twitter for iPhone</a>",This is Bert. He likes flowers. 10/10 https://t.co/lmQRrNxaQu,10,10,Bert,    ,744,2077,https://pbs.twimg.com/media/CWIngp5WEAAJOy3.jpg,1,Irish Water Spaniel,38.8,True,Standard Poodle,28.4,True,Greenhouse,3.5,False
1475,676101918813499392,2015-12-13 18:10:33 +0000,"<a href=""http://twitter.com/download/iphone"" rel=""nofollow"">Twitter for iPhone</a>",Meet Striker. He's ready for Christmas. 11/10 https://t.co/B3xxSLjQSH,11,10,Striker,    ,1284,3042,https://pbs.twimg.com/media/CWH FTgWIAAwOUy.jpg,1,Shih-Tzu,22.6,True,Norfolk Terrier,18.7,True,Irish Terrier,10.7,True
1476,676098748976615425,2015-12-13 17:57:57 +0000,"<a href=""http://twitter.com/download/iphone"" rel=""nofollow"">Twitter for iPhone</a>",Extremely rare pup here. Very religious. Always praying. Too many legs. Not overwhelmingly fluffy. Won't bark. 3/10 https://t.co/REyE5YKVBb,3,10, ,    ,1623,3279,https://pbs.twimg.com/media/CWH8L72UkAAvjql.jpg,1,Walking Stick,16.2,False,Sandal,12.9,False,Purse,8.1,False
1477,676089483918516224,2015-12-13 17:21:08 +0000,"<a href=""http://twitter.com/download/iphone"" rel=""nofollow"">Twitter for iPhone</a>","""Yes hello I'ma just snag this here toasted bagel real quick. carry on."" 9/10 https://t.co/Cuz0Osnekp",9,10, ,    ,483,1431,https://pbs.twimg.com/media/CWHzzFGXIAA0Y H.jpg,1,Bull Mastiff,74.4,True,Boxer,10.7,True,American Staffordshire Terrier,4.2,True
1478,675898130735476737,2015-12-13 04:40:46 +0000,"<a href=""http://twitter.com/download/iphone"" rel=""nofollow"">Twitter for iPhone</a>",I'm sure you've all seen this pupper. Not prepared at all for the flying disc of terror. 10/10 https://t.co/G0pQiFGM7O,10,10, ,  pupper ,653,1774,https://pbs.twimg.com/media/CWFFt3 XIAArIYK.jpg,1,Labrador Retriever,40.7,True,Malinois,7.7,True,Pug,7.5,True
1479,675891555769696257,2015-12-13 04:14:39 +0000,"<a href=""http://twitter.com/download/iphone"" rel=""nofollow"">Twitter for iPhone</a>",This is Donny. He's summoning the demon monster Babadook. 6/10 Donny please no that won't be a good time for anyone https://t.co/kiW6Knb7Gp,6,10,Donny,    ,976,2297,https://pbs.twimg.com/media/CWE x33UwAEE3no.jpg,1,Italian Greyhound,30.6,True,Whippet,23.2,True,Great Dane,11.8,True
1480,675888385639251968,2015-12-13 04:02:03 +0000,"<a href=""http://twitter.com/download/iphone"" rel=""nofollow"">Twitter for iPhone</a>",Breathtaking scene. A father taking care of his newborn pup. Tugs at the heartstrings. 10/10 restores my faith https://t.co/06oZdehGEa,10,10, ,    ,1067,2581,https://pbs.twimg.com/media/CWE85snWIAEG5ES.jpg,1,West Highland White Terrier,67.2,True,Old English Sheepdog,14.6,True,Komondor,2.3,True
1481,675878199931371520,2015-12-13 03:21:34 +0000,"<a href=""http://twitter.com/download/iphone"" rel=""nofollow"">Twitter for iPhone</a>","Ok, I'll admit this is a pretty adorable bunny hopping towards the ocean but please only send in dogs... 11/10 https://t.co/sfsVCGIipI",11,10, ,    ,1570,4531,https://pbs.twimg.com/media/CWEzo19WoAEiOCj.jpg,1,Wood Rabbit,78.6,False,Hare,11.8,False,Cardigan,4.4,True
1482,675870721063669760,2015-12-13 02:51:51 +0000,"<a href=""http://twitter.com/download/iphone"" rel=""nofollow"">Twitter for iPhone</a>",&amp; this is Yoshi. Another world record contender 11/10 (what the hell is happening why are there so many contenders?) https://t.co/QG708dDNH6,11,10, ,    ,632,1783,https://pbs.twimg.com/media/CWEs1b-WEAEhq82.jpg,1,Golden Retriever,26.4,True,Welsh Springer Spaniel,18.4,True,Beagle,18.2,True
1483,675853064436391936,2015-12-13 01:41:41 +0000,"<a href=""http://twitter.com/download/iphone"" rel=""nofollow"">Twitter for iPhone</a>",Here we have an entire platoon of puppers. Total score: 88/80 would pet all at once https://t.co/y93p6FLvVw,88,80, ,    ,1460,2927,https://pbs.twimg.com/media/CWEcxqWVEAAHyGH.jpg,1,Labrador Retriever,86.8,True,Golden Retriever,4.3,True,Vizsla,2.8,True
1484,675845657354215424,2015-12-13 01:12:15 +0000,"<a href=""http://twitter.com/download/iphone"" rel=""nofollow"">Twitter for iPhone</a>","This is Pepper. She's not fully comfortable riding her imaginary bike yet. 10/10 don't worry pupper, it gets easier https://t.co/40dj4eTsXG",10,10,Pepper,  pupper ,1000,2477,https://pbs.twimg.com/media/CWEWClfW4AAnqhG.jpg,1,Pug,88.4,True,Boston Bull,1.1,True,French Bulldog,1.0,True
1485,675822767435051008,2015-12-12 23:41:18 +0000,"<a href=""http://twitter.com/download/iphone"" rel=""nofollow"">Twitter for iPhone</a>",ðŸŽ¶ HELLO FROM THE OTHER SIIIIIIIIDE ðŸŽ¶ 10/10s https://t.co/GK2HJtkdQk,10,10, ,    ,591,1652,https://pbs.twimg.com/media/CWEBOFYWwAA-O2c.jpg,1,Pomeranian,46.1,True,Chow,20.3,True,Pekinese,13.3,True
1486,675820929667219457,2015-12-12 23:34:00 +0000,"<a href=""http://twitter.com/download/iphone"" rel=""nofollow"">Twitter for iPhone</a>",Here's a handful of sleepy puppers. All look unaware of their surroundings. Lousy guard dogs. Still cute tho 11/10s https://t.co/lyXX3v5j4s,11,10, ,    ,260,1140,https://pbs.twimg.com/media/CWD jQMWEAAdYwH.jpg,1,Basset,55.6,True,Beagle,20.2,True,Bloodhound,11.1,True
1487,675798442703122432,2015-12-12 22:04:39 +0000,"<a href=""http://twitter.com/download/iphone"" rel=""nofollow"">Twitter for iPhone</a>",This is Bernie. He just touched a boob for the first time. 10/10 https://t.co/whQKMygnK6,10,10,Bernie,    ,3787,11101,https://pbs.twimg.com/media/CWDrGH4UYAARoq .jpg,1,Beagle,68.1,True,Basset,12.5,True,Boxer,8.0,True
1488,675781562965868544,2015-12-12 20:57:34 +0000,"<a href=""http://twitter.com/download/iphone"" rel=""nofollow"">Twitter for iPhone</a>",Say hello to Buddah. He was Waldo for Halloween. 11/10 https://t.co/DVAqAnb624,11,10,Buddah,    ,537,1750,https://pbs.twimg.com/media/CWDbv2yU4AARfeH.jpg,1,Maltese Dog,92.2,True,West Highland White Terrier,1.8,True,Toy Poodle,1.4,True
1489,675740360753160193,2015-12-12 18:13:51 +0000,"<a href=""http://twitter.com/download/iphone"" rel=""nofollow"">Twitter for iPhone</a>",Here's a pupper licking in slow motion. 12/10 please enjoy https://t.co/AUJi8ujxw9,12,10, ,  pupper ,388,1257,https://pbs.twimg.com/ext tw video thumb/675740268751138818/pu/img/dVaVeFAVT-lk 1ZV.jpg,1,Golden Retriever,80.0,True,Kuvasz,9.8,True,Saluki,6.8,True
1490,675710890956750848,2015-12-12 16:16:45 +0000,"<a href=""http://twitter.com/download/iphone"" rel=""nofollow"">Twitter for iPhone</a>",This is Lenny. He was just told that he couldn't explore the fish tank. 12/10 smh all that work for nothing https://t.co/JWi6YrpiO1,12,10,Lenny,    ,928,2046,https://pbs.twimg.com/media/CWCbd8ZWoAAtqoH.jpg,2,Standard Schnauzer,44.1,True,Miniature Schnauzer,24.9,True,Sealyham Terrier,16.5,True
1491,675707330206547968,2015-12-12 16:02:36 +0000,"<a href=""http://twitter.com/download/iphone"" rel=""nofollow"">Twitter for iPhone</a>",We've got ourselves a battle here. Watch out Reggie. 11/10 https://t.co/ALJvbtcwf0,11,10, ,    ,771,2154,https://pbs.twimg.com/media/CWCYOqWUAAARmGr.jpg,1,Bath Towel,72.2,False,Staffordshire Bullterrier,5.9,True,Bagel,3.6,False
