,tweet_id,timestamp,source,text,rating_numerator,rating_denominator,pet_name,stage,retweet_count,favorite_count,image_url,image_number,first_prediction,first_prediction_confidence(%),first_prediction_is_dog,second_prediction,second_prediction_confidence(%),second_prediction_is_dog,third_prediction,third_prediction_confidence(%),third_prediction_is_dog
481,789628658055020548,2016-10-22 00:45:17 +0000,"<a href=""http://twitter.com/download/iphone"" rel=""nofollow"">Twitter for iPhone</a>",This is Eli. He can fly. 13/10 magical af https://t.co/huPSJJ7FDI,13,10,Eli,    ,2080,8448,https://pbs.twimg.com/media/CvVTEnPXYAAWLyL.jpg,1,Chow,26.1,True,Cougar,8.8,False,Pomeranian,8.0,True
482,789599242079838210,2016-10-21 22:48:24 +0000,"<a href=""http://twitter.com/download/iphone"" rel=""nofollow"">Twitter for iPhone</a>",This is Brownie. She's wearing a Halloween themed onesie. 12/10 festive af https://t.co/0R4meWXFOx,12,10,Brownie,    ,2279,7620,https://pbs.twimg.com/media/CvU4UZpXgAE1pAV.jpg,2,Chesapeake Bay Retriever,87.9,True,Beagle,1.9,True,Labrador Retriever,1.7,True
483,789530877013393408,2016-10-21 18:16:44 +0000,"<a href=""http://twitter.com/download/iphone"" rel=""nofollow"">Twitter for iPhone</a>",This is Rizzy. She smiles a lot. 12/10 contagious af https://t.co/TU4sZogVIq,12,10,Rizzy,    ,3942,13188,https://pbs.twimg.com/media/CvT6IV6WEAQhhV5.jpg,3,Schipperke,36.3,True,Kelpie,19.7,True,Norwegian Elkhound,15.1,True
484,789268448748703744,2016-10-21 00:53:56 +0000,"<a href=""http://twitter.com/download/iphone"" rel=""nofollow"">Twitter for iPhone</a>",This is Stella. She's happier than I will ever be. 10/10 would trade lives with https://t.co/JSs2bfDtTS,10,10,Stella,    ,3014,10196,https://pbs.twimg.com/media/CvQLdotWcAAZn86.jpg,1,Malamute,81.3,True,Siberian Husky,12.1,True,Eskimo Dog,2.4,True
485,789137962068021249,2016-10-20 16:15:26 +0000,"<a href=""http://twitter.com/download/iphone"" rel=""nofollow"">Twitter for iPhone</a>",This is Bo. He's a West Congolese Bugaboop Snuggle. Rather exotic. Master of the head tilt. 12/10 would pay to pet https://t.co/2jwxxtNzoN,12,10,Bo,    ,3244,10875,https://pbs.twimg.com/media/CvOUw8vWYAAzJDq.jpg,2,Chihuahua,74.6,True,Pekinese,7.0,True,Pembroke,4.9,True
486,788908386943430656,2016-10-20 01:03:11 +0000,"<a href=""http://twitter.com/download/iphone"" rel=""nofollow"">Twitter for iPhone</a>","This is Lucy. She destroyed not one, but two remotes trying to turn off the debate. 11/10 relatable af https://t.co/3BXh073tDm",11,10,Lucy,    ,14409,30653,https://pbs.twimg.com/media/CvLD-mbWYAAFI8w.jpg,1,Remote Control,88.2,False,Oscilloscope,3.6,False,Golden Retriever,3.4,True
487,788765914992902144,2016-10-19 15:37:03 +0000,"<a href=""http://twitter.com/download/iphone"" rel=""nofollow"">Twitter for iPhone</a>",This is Butter. She can have whatever she wants forever. 12/10 would hug softly https://t.co/x5gXRS1abq,12,10,Butter,    ,12014,30658,https://pbs.twimg.com/media/CvJCabcWgAIoUxW.jpg,1,Cocker Spaniel,50.1,True,Golden Retriever,27.3,True,Jigsaw Puzzle,4.1,False
488,788412144018661376,2016-10-18 16:11:17 +0000,"<a href=""http://twitter.com/download/iphone"" rel=""nofollow"">Twitter for iPhone</a>",This is Dexter. He breaks hearts for a living. 11/10 h*ckin handsome af https://t.co/4DhSsC1W7S,11,10,Dexter,    ,5990,16060,https://pbs.twimg.com/media/CvEAqQoWgAADj5K.jpg,1,Golden Retriever,80.5,True,Labrador Retriever,11.4,True,Brittany Spaniel,3.9,True
489,788178268662984705,2016-10-18 00:41:57 +0000,"<a href=""http://twitter.com/download/iphone"" rel=""nofollow"">Twitter for iPhone</a>",Atlas is back and this time he's got doggles. Still 13/10 solarly conscious af https://t.co/s7MgFWDySc,13,10, ,    ,2488,8100,https://pbs.twimg.com/media/CvAr88kW8AEKNAO.jpg,2,Samoyed,73.5,True,Pomeranian,7.5,True,Arctic Fox,3.6,False
490,788150585577050112,2016-10-17 22:51:57 +0000,"<a href=""http://twitter.com/download/iphone"" rel=""nofollow"">Twitter for iPhone</a>",This is Leo. He's a golden chow. Rather h*ckin rare. 13/10 would give extra pats https://t.co/xosHjFzVXc,13,10,Leo,    ,1510,6865,https://pbs.twimg.com/media/CvASw6dWcAQmo3X.jpg,3,Chow,81.4,True,Pomeranian,11.3,True,Chihuahua,1.6,True
491,788039637453406209,2016-10-17 15:31:05 +0000,"<a href=""http://twitter.com/download/iphone"" rel=""nofollow"">Twitter for iPhone</a>",Did... did they pick out that license plate? 12/10 for both https://t.co/lRmUUOxgbQ,12,10, ,    ,1535,6867,https://pbs.twimg.com/media/Cu-t20yWEAAFHXi.jpg,1,Beach Wagon,36.3,False,Minivan,30.5,False,Limousine,10.2,False
492,787810552592695296,2016-10-17 00:20:47 +0000,"<a href=""http://twitter.com/download/iphone"" rel=""nofollow"">Twitter for iPhone</a>",This is Frank. He wears sunglasses and walks himself. 11/10 I'll never be this cool or independent https://t.co/pNNjBtHWPc,11,10,Frank,    ,3540,9717,https://pbs.twimg.com/media/Cu7dg2RXYAIaGXE.jpg,2,Pug,36.3,True,French Bulldog,22.2,True,English Setter,8.0,True
493,787717603741622272,2016-10-16 18:11:26 +0000,"<a href=""http://twitter.com/download/iphone"" rel=""nofollow"">Twitter for iPhone</a>",This is Tonks. She is a service puppo. Can hear a caterpillar hiccup from 7 miles away. 13/10 would follow anywhere https://t.co/i622ZbWkUp,13,10,Tonks,   puppo,3240,11416,https://pbs.twimg.com/media/Cu6I9vvWIAAZG0a.jpg,3,German Shepherd,99.2,True,Malinois,0.5,True,Kelpie,0.1,True
494,787397959788929025,2016-10-15 21:01:17 +0000,"<a href=""http://twitter.com/download/iphone"" rel=""nofollow"">Twitter for iPhone</a>",This is Moose. He's rather h*ckin dangerous (you can tell by the collar). 11/10 would still attempt to snug https://t.co/lHVHGdDzb3,11,10,Moose,    ,3300,12120,https://pbs.twimg.com/media/Cu1mQsDWEAAU VQ.jpg,1,Chihuahua,90.0,True,Toy Terrier,2.1,True,Miniature Pinscher,1.9,True
495,787322443945877504,2016-10-15 16:01:13 +0000,"<a href=""http://twitter.com/download/iphone"" rel=""nofollow"">Twitter for iPhone</a>",This is Lincoln. He forgot to use his blinker when he changed lanes just now. Guilty as h*ck. Still 10/10 https://t.co/lsrR83SiVp,10,10,Lincoln,    ,2032,8726,https://pbs.twimg.com/media/Cu0hlfwWYAEdnXO.jpg,1,Seat Belt,74.8,False,Golden Retriever,10.6,True,Dingo,1.7,False
496,786963064373534720,2016-10-14 16:13:10 +0000,"<a href=""http://twitter.com/download/iphone"" rel=""nofollow"">Twitter for iPhone</a>",This is Rory. He's got an interview in a few minutes. Looking spiffy af. Nervous as h*ck tho. 12/10 would hire https://t.co/ibj5g6xaAj,12,10,Rory,    ,9327,29725,https://pbs.twimg.com/media/Cuvau3MW8AAxaRv.jpg,1,Golden Retriever,91.5,True,Saluki,4.6,True,Labrador Retriever,3.8,True
497,786709082849828864,2016-10-13 23:23:56 +0000,"<a href=""http://twitter.com/download/iphone"" rel=""nofollow"">Twitter for iPhone</a>","This is Logan, the Chow who lived. He solemnly swears he's up to lots of good. H*ckin magical af 9.75/10 https://t.co/yBO5wuqaPS",75,10,Logan,    ,7069,20296,https://pbs.twimg.com/media/CurzvFTXgAA2 AP.jpg,1,Pomeranian,46.7,True,Persian Cat,12.3,False,Chow,10.3,True
498,786664955043049472,2016-10-13 20:28:35 +0000,"<a href=""http://twitter.com/download/iphone"" rel=""nofollow"">Twitter for iPhone</a>","""Honestly Kathleen I just want more Ken Bone"" 12/10 https://t.co/HmlEvAMP4r",12,10, ,    ,2996,11957,https://pbs.twimg.com/media/CurLmoqXgAEPoJ-.jpg,1,Leonberg,51.2,True,Keeshond,46.5,True,Pomeranian,0.8,True
499,786595970293370880,2016-10-13 15:54:28 +0000,"<a href=""http://twitter.com/download/iphone"" rel=""nofollow"">Twitter for iPhone</a>",This is Dale. He's a real spookster. Did me quite the frighten. 11/10 not too spooky to pet tho https://t.co/L8BWDD4oBX,11,10,Dale,    ,3601,10497,https://pbs.twimg.com/media/CuqM0fVWAAAboKR.jpg,1,Pembroke,71.0,True,Cardigan,28.7,True,Chow,0.1,True
500,786363235746385920,2016-10-13 00:29:39 +0000,"<a href=""http://twitter.com/download/iphone"" rel=""nofollow"">Twitter for iPhone</a>",This is Rizzo. He has many talents. A true renaissance doggo. 13/10 entertaining af https://t.co/TVXpEJB7Wn,13,10,Rizzo,doggo   ,4072,12189,https://pbs.twimg.com/media/Cum5LlfWAAAyPcS.jpg,1,Golden Retriever,92.9,True,Labrador Retriever,6.3,True,Saluki,0.2,True
501,786233965241827333,2016-10-12 15:55:59 +0000,"<a href=""http://twitter.com/download/iphone"" rel=""nofollow"">Twitter for iPhone</a>",This is Mattie. She's extremely dangerous. Will bite your h*ckin finger right off. Still 11/10 would pet with caution https://t.co/78c9W8kLFh,11,10,Mattie,    ,5571,17178,https://pbs.twimg.com/media/CulDnZpWcAAGbZ-.jpg,1,Labrador Retriever,47.8,True,Schipperke,22.5,True,Staffordshire Bullterrier,7.7,True
502,785927819176054784,2016-10-11 19:39:28 +0000,"<a href=""http://twitter.com/download/iphone"" rel=""nofollow"">Twitter for iPhone</a>",This is Lucy. She's strives to be the best potato she can be. 12/10 would boop https://t.co/lntsj7Fc4Y,12,10,Lucy,    ,3652,12696,https://pbs.twimg.com/media/CugtKeXWEAAamDZ.jpg,1,Teddy,97.2,False,Toy Poodle,0.8,True,Chow,0.3,True
503,785872687017132033,2016-10-11 16:00:24 +0000,"<a href=""http://twitter.com/download/iphone"" rel=""nofollow"">Twitter for iPhone</a>",Meet Rusty. He appears to be rather h*ckin fluffy. Also downright adorable af. 12/10 would rub my face against his https://t.co/1j9kLGb4wV,12,10,Rusty,    ,2130,7489,https://pbs.twimg.com/ext tw video thumb/785872596088811520/pu/img/5O- BgqdFQu 2Bt7.jpg,1,Great Pyrenees,39.2,True,Golden Retriever,19.8,True,Pekinese,14.3,True
504,785533386513321988,2016-10-10 17:32:08 +0000,"<a href=""http://twitter.com/download/iphone"" rel=""nofollow"">Twitter for iPhone</a>",This is Dallas. Her tongue is ridiculous. 11/10 h*ckin proud af https://t.co/h4jhlH4EyG,11,10,Dallas,    ,2334,10183,https://pbs.twimg.com/media/CubGchjXEAA6gpw.jpg,2,Miniature Pinscher,43.6,True,Black-And-Tan Coonhound,25.8,True,Rottweiler,14.5,True
505,785264754247995392,2016-10-09 23:44:41 +0000,"<a href=""http://twitter.com/download/iphone"" rel=""nofollow"">Twitter for iPhone</a>",This is Doc. He requested to be carried around like that. 12/10 anything for Doc https://t.co/mWYACm4qnx,12,10,Doc,    ,1911,8128,https://pbs.twimg.com/media/CuXSHNnWcAIWEwn.jpg,1,Teddy,67.5,False,Cradle,5.7,False,Chow,5.6,True
506,785170936622350336,2016-10-09 17:31:53 +0000,"<a href=""http://twitter.com/download/iphone"" rel=""nofollow"">Twitter for iPhone</a>",This is Hero. He was enjoying the car ride until he remembered that bees are dying globally at an alarming rate. 11/10 https://t.co/cubFg7F4qQ,11,10,Hero,    ,5639,13491,https://pbs.twimg.com/media/CuV8yfxXEAAUlye.jpg,2,Seat Belt,89.1,False,Eskimo Dog,2.7,True,Samoyed,2.0,True
507,784826020293709826,2016-10-08 18:41:19 +0000,"<a href=""http://twitter.com/download/iphone"" rel=""nofollow"">Twitter for iPhone</a>",This is Rusty. He's going D1 for sure. Insane vertical. 13/10 would draft https://t.co/AsykOwMrXQ,13,10,Rusty,    ,3712,11310,https://pbs.twimg.com/media/CuRDF-XWcAIZSer.jpg,1,Chow,9.0,True,Binoculars,8.3,False,Irish Setter,7.7,True
508,784517518371221505,2016-10-07 22:15:26 +0000,"<a href=""http://twitter.com/download/iphone"" rel=""nofollow"">Twitter for iPhone</a>",This is Frankie. He has yet to learn how to control his tongue. 11/10 maybe one day https://t.co/p6fgYe2dB6,11,10,Frankie,    ,2970,10039,https://pbs.twimg.com/media/CuMqhGrXYAQwRqU.jpg,2,Malamute,75.8,True,Eskimo Dog,15.1,True,Siberian Husky,8.5,True
509,784431430411685888,2016-10-07 16:33:21 +0000,"<a href=""http://twitter.com/download/iphone"" rel=""nofollow"">Twitter for iPhone</a>",This is Stormy. He's curly af. Already pupared for Coachella next year. 12/10 https://t.co/PHA1vtqqpt,12,10,Stormy,    ,1491,6329,https://pbs.twimg.com/media/CuLcNkCXgAEIwK2.jpg,1,Miniature Poodle,74.5,True,Toy Poodle,24.3,True,Standard Poodle,1.1,True
510,783839966405230592,2016-10-06 01:23:05 +0000,"<a href=""http://twitter.com/download/iphone"" rel=""nofollow"">Twitter for iPhone</a>",This is Riley. His owner put a donut pillow around him and he loves it so much he won't let anyone take it off. 13/10 https://t.co/8TCQcsZCZ8,13,10,Riley,    ,12643,33689,https://pbs.twimg.com/media/CuDCSM-XEAAJw1W.jpg,1,Quilt,33.4,False,Siamese Cat,13.6,False,Three-Toed Sloth,11.7,False
511,783821107061198850,2016-10-06 00:08:09 +0000,"<a href=""http://twitter.com/download/iphone"" rel=""nofollow"">Twitter for iPhone</a>",This is Mairi. She has mastered the art of camouflage. 12/10 h*ckin sneaky af https://t.co/STcPjiNAHp,12,10,Mairi,    ,2269,8209,https://pbs.twimg.com/media/CuCxIzyWEAQTnQA.jpg,1,Lakeland Terrier,26.6,True,Golden Retriever,19.6,True,Standard Poodle,13.4,True
512,783695101801398276,2016-10-05 15:47:27 +0000,"<a href=""http://twitter.com/download/iphone"" rel=""nofollow"">Twitter for iPhone</a>",This is Loomis. He's the leader of the Kenneth search party. The passion is almost overwhelming. 12/10 one day he will be free https://t.co/kCRKlFg4AY,12,10,Loomis,    ,3737,11650,https://pbs.twimg.com/media/CuA-iRHXYAAWP8e.jpg,3,Chow,31.4,True,Golden Retriever,30.0,True,Australian Terrier,4.9,True
513,783466772167098368,2016-10-05 00:40:09 +0000,"<a href=""http://twitter.com/download/iphone"" rel=""nofollow"">Twitter for iPhone</a>",This is Finn. He likes eavesdropping from filing cabinets. It's a real issue but no one has approached him about it. 11/10 would still pet https://t.co/s8W8Del9HQ,11,10,Finn,    ,2608,9468,https://pbs.twimg.com/media/Ct9u3ljW8AEnVIm.jpg,1,Chihuahua,78.9,True,Miniature Pinscher,11.6,True,Toy Terrier,3.6,True
514,783391753726550016,2016-10-04 19:42:03 +0000,"<a href=""http://twitter.com/download/iphone"" rel=""nofollow"">Twitter for iPhone</a>",Meet Godi. He's an avid beachgoer and part time rainbow summoner. Eyeliner flawless af. 13/10 would snug well https://t.co/BO936YdJdi,13,10,Godi,    ,6441,18908,https://pbs.twimg.com/media/Ct8qn8EWIAAk9zP.jpg,4,Norwegian Elkhound,87.7,True,Cairn,8.6,True,Keeshond,1.1,True
515,783334639985389568,2016-10-04 15:55:06 +0000,"<a href=""http://twitter.com/download/iphone"" rel=""nofollow"">Twitter for iPhone</a>",This is Dave. He's currently in a predicament. Doesn't seem to mind tho. 12/10 someone assist Dave https://t.co/nfprKAXqwu,12,10,Dave,    ,13616,32651,https://pbs.twimg.com/media/Ct72q9jWcAAhlnw.jpg,2,Cardigan,59.4,True,Shetland Sheepdog,13.1,True,Pembroke,10.1,True
516,783085703974514689,2016-10-03 23:25:55 +0000,"<a href=""http://twitter.com/download/iphone"" rel=""nofollow"">Twitter for iPhone</a>",This is Earl. He can't catch. Did his best tho. 11/10 would repair confidence with extra pats https://t.co/IsqyvbjFgM,11,10,Earl,    ,2565,9112,https://pbs.twimg.com/media/Ct4URfWUAAQ7lKe.jpg,1,Chesapeake Bay Retriever,24.1,True,Airedale,16.4,True,Boxer,13.5,True
517,782969140009107456,2016-10-03 15:42:44 +0000,"<a href=""http://twitter.com/download/iphone"" rel=""nofollow"">Twitter for iPhone</a>",This is Cali. She arrived preassembled. Convenient af. 12/10 appears to be rather h*ckin pettable https://t.co/vOBV1ZqVcX,12,10,Cali,    ,8521,26949,https://pbs.twimg.com/media/Ct2qO5PXEAE6eB0.jpg,1,Seat Belt,47.4,False,Golden Retriever,17.1,True,Labrador Retriever,11.1,True
518,782747134529531904,2016-10-03 01:00:34 +0000,"<a href=""http://twitter.com/download/iphone"" rel=""nofollow"">Twitter for iPhone</a>",This is Deacon. He's the happiest almost dry doggo I've ever seen. 11/10 would smile back https://t.co/C6fUMnHt1H,11,10,Deacon,doggo   ,1604,8310,https://pbs.twimg.com/media/CtzgXgeXYAA1Gxw.jpg,1,Golden Retriever,56.1,True,Otterhound,19.9,True,Clumber,4.1,True
519,782722598790725632,2016-10-02 23:23:04 +0000,"<a href=""http://twitter.com/download/iphone"" rel=""nofollow"">Twitter for iPhone</a>","This is Penny. She fought a bee and the bee won. 10/10 you're fine Penny, everything's fine https://t.co/zrMVdfFej6",10,10,Penny,    ,6238,19250,https://pbs.twimg.com/media/CtzKC7zXEAALfSo.jpg,1,Irish Setter,57.5,True,Golden Retriever,33.9,True,Seat Belt,4.6,False
520,782598640137187329,2016-10-02 15:10:30 +0000,"<a href=""http://twitter.com/download/iphone"" rel=""nofollow"">Twitter for iPhone</a>",This is Timmy. He's quite large. According to a trusted source it's actually a dog wearing a dog suit. 11/10 https://t.co/BIUchFwHqn,11,10,Timmy,    ,2184,8694,https://pbs.twimg.com/media/CtxZTtxUMAEduGo.jpg,1,Malamute,84.1,True,Tibetan Mastiff,14.1,True,Eskimo Dog,1.2,True
521,782305867769217024,2016-10-01 19:47:08 +0000,"<a href=""http://twitter.com/download/iphone"" rel=""nofollow"">Twitter for iPhone</a>",This is Sampson. He just graduated. Ready to be a doggo now. Time for the real world. 12/10 have fun with taxes https://t.co/pgVKxRw0s1,12,10,Sampson,doggo   ,6470,18630,https://pbs.twimg.com/media/CttPBt0WIAAcsDE.jpg,1,Briard,50.4,True,Soft-Coated Wheaten Terrier,39.1,True,Lhasa,3.5,True
522,781955203444699136,2016-09-30 20:33:43 +0000,"<a href=""http://twitter.com/download/iphone"" rel=""nofollow"">Twitter for iPhone</a>",This is Chipson. He weighed in at .3 ounces and is officially super h*ckin smol. Space-saving af. 11/10 would snug delicately https://t.co/FjEsk7A1JV,11,10,Chipson,    ,3920,12357,https://pbs.twimg.com/media/CtoQGu4XgAQgv5m.jpg,1,Pool Table,18.0,False,Dining Table,15.4,False,Microwave,3.4,False
523,781661882474196992,2016-09-30 01:08:10 +0000,"<a href=""http://twitter.com/download/iphone"" rel=""nofollow"">Twitter for iPhone</a>",Who keeps sending in pictures without dogs in them? This needs to stop. 5/10 for the mediocre road https://t.co/ELqelxWMrC,5,10, ,    ,3129,11634,https://pbs.twimg.com/media/CtkFS72WcAAiUrs.jpg,1,Pembroke,43.8,True,Golden Retriever,22.7,True,Collie,7.1,True
524,781524693396357120,2016-09-29 16:03:01 +0000,"<a href=""http://twitter.com/download/iphone"" rel=""nofollow"">Twitter for iPhone</a>",Idk why this keeps happening. We only rate dogs. Not Bangladeshi Couch Chipmunks. Please only send dogs... 12/10 https://t.co/ya7bviQUUf,12,10, ,    ,6426,23163,https://pbs.twimg.com/media/CtiIj0AWcAEBDvw.jpg,1,Tennis Ball,99.5,False,Chesapeake Bay Retriever,0.4,True,Labrador Retriever,0.1,True
525,781251288990355457,2016-09-28 21:56:36 +0000,"<a href=""http://twitter.com/download/iphone"" rel=""nofollow"">Twitter for iPhone</a>",This is Oakley. He just got yelled at for going 46 in a 45. Churlish af. 11/10 would still pet so well https://t.co/xIYsa6LPA4,11,10,Oakley,    ,2458,9428,https://pbs.twimg.com/media/CteP5H5WcAEhdLO.jpg,2,Mexican Hairless,88.8,True,Italian Greyhound,3.1,True,Seat Belt,2.7,False
526,781163403222056960,2016-09-28 16:07:23 +0000,"<a href=""http://twitter.com/download/iphone"" rel=""nofollow"">Twitter for iPhone</a>","We normally don't rate lobsters, but this one appears to be a really good lobster. 10/10 would pet with caution https://t.co/YkHc7U7uUy",10,10, ,    ,3168,10895,https://pbs.twimg.com/media/Ctc -BTWEAAQpZh.jpg,1,Shetland Sheepdog,97.4,True,Collie,2.5,True,Border Collie,0.0,True
527,780931614150983680,2016-09-28 00:46:20 +0000,"<a href=""http://twitter.com/download/iphone"" rel=""nofollow"">Twitter for iPhone</a>",I want to finally rate this iconic puppo who thinks the parade is all for him. 13/10 would absolutely attend https://t.co/5dUYOu4b8d,13,10, ,   puppo,8536,24192,https://pbs.twimg.com/media/CtZtJxAXEAAyPGd.jpg,1,Padlock,73.2,False,Necklace,6.5,False,Chain,3.6,False
528,780858289093574656,2016-09-27 19:54:58 +0000,"<a href=""http://twitter.com/download/iphone"" rel=""nofollow"">Twitter for iPhone</a>","This is Dash. He's very stylish, but also incredibly unimpressed with the current state of our nation. 10/10 would pet ears first https://t.co/YElO4hvXI6",10,10,Dash,    ,2328,8033,https://pbs.twimg.com/media/CtYqeNHWgAATqYZ.jpg,1,Chesapeake Bay Retriever,48.9,True,Sussex Spaniel,27.2,True,Kelpie,10.7,True
529,780800785462489090,2016-09-27 16:06:28 +0000,"<a href=""http://twitter.com/download/iphone"" rel=""nofollow"">Twitter for iPhone</a>",This is Koda. He has a weird relationship with tall grass. Slightly concerning. 11/10 would def still pet https://t.co/KQzSR8eCsw,11,10,Koda,    ,1505,6141,https://pbs.twimg.com/media/CtX2Kr9XYAAuxrM.jpg,2,Siberian Husky,95.2,True,Eskimo Dog,3.5,True,Pembroke,0.9,True
530,780601303617732608,2016-09-27 02:53:48 +0000,"<a href=""http://twitter.com/download/iphone"" rel=""nofollow"">Twitter for iPhone</a>",Meet Hercules. He can have whatever he wants for the rest of eternity. 12/10 would snug passionately https://t.co/mH0IOyFdIG,12,10,Hercules,    ,3839,13525,https://pbs.twimg.com/media/CtVAvX-WIAAcGTf.jpg,1,Saint Bernard,99.5,True,Cardigan,0.3,True,English Springer,0.1,True
531,780543529827336192,2016-09-26 23:04:13 +0000,"<a href=""http://twitter.com/download/iphone"" rel=""nofollow"">Twitter for iPhone</a>",Here's a perturbed super floof. 12/10 would snug so damn well https://t.co/VG095mi09Q,12,10, ,    ,2032,7040,https://pbs.twimg.com/media/CtUMLzRXgAAbZK5.jpg,1,Golden Retriever,62.8,True,Labrador Retriever,31.7,True,Tibetan Mastiff,1.2,True
532,780459368902959104,2016-09-26 17:29:48 +0000,"<a href=""http://twitter.com/download/iphone"" rel=""nofollow"">Twitter for iPhone</a>","This is Bear. Don't worry, he's not a real bear tho. Contains unreal amounts of squish. 11/10 heteroskedastic af https://t.co/coi4l1T2Sm",11,10,Bear,    ,1224,5892,https://pbs.twimg.com/media/CtS p9kXEAE2nh8.jpg,1,Great Dane,38.2,True,German Shepherd,31.2,True,Bull Mastiff,3.3,True
533,780192070812196864,2016-09-25 23:47:39 +0000,"<a href=""http://twitter.com/download/iphone"" rel=""nofollow"">Twitter for iPhone</a>",We only rate dogs. Pls stop sending in non-canines like this Urban Floof Giraffe. I can't handle this. 11/10 https://t.co/zHIqpM5Gni,11,10, ,    ,2589,9712,https://pbs.twimg.com/media/CtPMhwvXYAIt6NG.jpg,1,Vizsla,14.4,True,Mongoose,9.1,False,Hatchet,7.4,False
534,779834332596887552,2016-09-25 00:06:08 +0000,"<a href=""http://twitter.com/download/iphone"" rel=""nofollow"">Twitter for iPhone</a>",This is Scout. He really wants to kiss himself. H*ckin inappropriate. 11/10 narcissistic af https://t.co/x0gV2Ck3AD,11,10,Scout,    ,8237,21252,https://pbs.twimg.com/media/CtKHLuCWYAA2TTs.jpg,1,Golden Retriever,99.4,True,Cocker Spaniel,0.3,True,Great Pyrenees,0.1,True
535,779377524342161408,2016-09-23 17:50:56 +0000,"<a href=""http://twitter.com/download/iphone"" rel=""nofollow"">Twitter for iPhone</a>",Have you ever seen such a smol pupper? Portable af. 12/10 would keep in shirt pocket https://t.co/KsqaIzlQ12,12,10, ,  pupper ,3613,9831,https://pbs.twimg.com/ext tw video thumb/779377444025499652/pu/img/eIiLDy9F6rPNarEc.jpg,1,Sundial,17.1,False,Cash Machine,6.0,False,Maze,5.5,False
536,779123168116150273,2016-09-23 01:00:13 +0000,"<a href=""http://twitter.com/download/iphone"" rel=""nofollow"">Twitter for iPhone</a>",This is Reggie. He hugs everyone he meets. 12/10 keep spreading the love Reggie https://t.co/uMfhduaate,12,10,Reggie,    ,4207,13206,https://pbs.twimg.com/media/CtAAYizW8AAWzBZ.jpg,1,Toy Poodle,43.1,True,Soft-Coated Wheaten Terrier,6.0,True,Cocker Spaniel,6.0,True
537,779056095788752897,2016-09-22 20:33:42 +0000,"<a href=""http://twitter.com/download/iphone"" rel=""nofollow"">Twitter for iPhone</a>",Everybody drop what you're doing and look at this dog. 13/10 must be super h*ckin rare https://t.co/I1bJUzUEW5,13,10, ,    ,5247,16500,https://pbs.twimg.com/media/Cs DYr1XEAA54Pu.jpg,1,Chihuahua,72.1,True,Toy Terrier,11.3,True,Kelpie,5.3,True
538,778990705243029504,2016-09-22 16:13:51 +0000,"<a href=""http://twitter.com/download/iphone"" rel=""nofollow"">Twitter for iPhone</a>",This is Jay. He's really h*ckin happy about the start of fall. Sneaky tongue slip in 2nd pic. 11/10 snuggly af https://t.co/vyx1X5eyWI,11,10,Jay,    ,8437,22342,https://pbs.twimg.com/media/Cs-H5uhWcAAiNY9.jpg,2,Cocker Spaniel,71.5,True,Labrador Retriever,20.7,True,Chihuahua,2.9,True
539,778748913645780993,2016-09-22 00:13:04 +0000,"<a href=""http://twitter.com/download/iphone"" rel=""nofollow"">Twitter for iPhone</a>","This is Mya (pronounced ""mmmyah?""). Her head is round af. 11/10 would pat accordingly https://t.co/1dpEuALnY0",11,10,Mya,    ,1562,7717,https://pbs.twimg.com/media/Cs6r -kVIAALh1p.jpg,1,Staffordshire Bullterrier,35.1,True,Boxer,20.1,True,American Staffordshire Terrier,14.3,True
540,778650543019483137,2016-09-21 17:42:10 +0000,"<a href=""http://twitter.com/download/iphone"" rel=""nofollow"">Twitter for iPhone</a>","Meet Strider. He thinks he's a sorority girl. Already wants to go to NYC for a weekend to say he's ""studied abroad"" 10/10 https://t.co/KYZkPuiC1l",10,10,Strider,    ,1729,6430,https://pbs.twimg.com/media/Cs5ShihWEAAH2ti.jpg,1,German Shepherd,51.6,True,Malinois,30.0,True,Kelpie,8.7,True
541,778624900596654080,2016-09-21 16:00:17 +0000,"<a href=""http://twitter.com/download/iphone"" rel=""nofollow"">Twitter for iPhone</a>",This is Penny. She's a sailor pup. 11/10 would take to the open seas with https://t.co/0rRxyBQt32,11,10,Penny,    ,1176,5177,https://pbs.twimg.com/media/Cs47N3eWcAEmgiW.jpg,2,Airedale,78.6,True,Irish Terrier,12.1,True,Lakeland Terrier,1.5,True
542,778408200802557953,2016-09-21 01:39:11 +0000,"<a href=""http://twitter.com/download/iphone"" rel=""nofollow"">Twitter for iPhone</a>",RIP Loki. Thank you for the good times. You will be missed by many. 14/10 https://t.co/gJKD9pst5A,14,10, ,    ,5023,15135,https://pbs.twimg.com/media/Cs12ICuWAAECNRy.jpg,3,Pembroke,84.8,True,Cardigan,10.8,True,Beagle,1.2,True
543,778383385161035776,2016-09-21 00:00:35 +0000,"<a href=""http://twitter.com/download/iphone"" rel=""nofollow"">Twitter for iPhone</a>",This is Nala. She's a future Dogue model. Won't respond to my texts. 13/10 would be an honor to pet https://t.co/zP1IvAATWv,13,10,Nala,    ,1271,6515,https://pbs.twimg.com/media/Cs1fjyqWIAE2jop.jpg,1,Collie,34.5,True,Borzoi,31.3,True,Border Collie,21.3,True
